account,city,coop_name,source_text,href
Abbyville Farmers Co-op Grain Co.,Abbyville,Farmers Co-op Grain Co.,Abbyville: Farmers Co-op Grain Co.,https://www.abbyvillecoop.com/
Alma Alma Cooperative Oil Assn.,Alma,Alma Cooperative Oil Assn.,Alma: Alma Cooperative Oil Assn.,https://almaco-op.com
Anthony Anthony Farmers Cooperative,Anthony,Anthony Farmers Cooperative,Anthony: Anthony Farmers Cooperative,https://www.anthonycoop.com/
Arkansas City Two Rivers Consumers Co-op Association,Arkansas City,Two Rivers Consumers Co-op Association,Arkansas City: Two Rivers Consumers Co-op Association,https://www.tworiversks.coop
Atwood Beardsley Equity Cooperative Association,Atwood,Beardsley Equity Cooperative Association,Atwood: Beardsley Equity Cooperative Association,https://beardsleycoop.com/
Bartlett Bartlett Co-op Association,Bartlett,Bartlett Co-op Association,Bartlett: Bartlett Co-op Association,https://www.bartlettco-op.com/
Bazine Cooperative Grain & Supply Company,Bazine,Cooperative Grain & Supply Company,Bazine: Cooperative Grain & Supply Company,https://cgscoop.net/
"Beloit AgMark, LLC",Beloit,"AgMark, LLC","Beloit: AgMark, LLC",https://www.agmarkllc.com/
Bremen Central Plains Organic Farmers,Bremen,Central Plains Organic Farmers,Bremen: Central Plains Organic Farmers,https://www.centralplainsorganic.com
"Cheney and Enid, OK CoMark Equity Alliance LLC (CEA)","Cheney and Enid, OK",CoMark Equity Alliance LLC (CEA),"Cheney and Enid, OK: CoMark Equity Alliance LLC (CEA)",https://www.ceagrain.com/
Colby Hi-Plains Cooperative Association,Colby,Hi-Plains Cooperative Association,Colby: Hi-Plains Cooperative Association,https://www.hi-plainscoop.com/
Columbus Farmers Cooperative Association,Columbus,Farmers Cooperative Association,Columbus: Farmers Cooperative Association,https://www.farmerscoop.coop/
"Concordia Cloud County Co-op Elevator Association, Inc.",Concordia,"Cloud County Co-op Elevator Association, Inc.","Concordia: Cloud County Co-op Elevator Association, Inc.",https://www.cloudcountycoopinc.com
Conway Springs Farmers Cooperative Grain Association,Conway Springs,Farmers Cooperative Grain Association,Conway Springs: Farmers Cooperative Grain Association,https://www.cscoop.net/
Dodge City Pride Ag Resources,Dodge City,Pride Ag Resources,Dodge City: Pride Ag Resources,https://www.prideag.com/
"Dodge City Servi-Tech, Inc.",Dodge City,"Servi-Tech, Inc.","Dodge City: Servi-Tech, Inc.",https://www.servitech.com
"Ellis Golden Belt Co-op Association, Inc.",Ellis,"Golden Belt Co-op Association, Inc.","Ellis: Golden Belt Co-op Association, Inc.",https://www.goldenbeltcoop.com/
Ellsworth The Ellsworth Co-op,Ellsworth,The Ellsworth Co-op,Ellsworth: The Ellsworth Co-op,https://www.ellsworthcoop.com/
Fowler Fowler Equity Exchange,Fowler,Fowler Equity Exchange,Fowler: Fowler Equity Exchange,https://www.fowlerequity.com/
"Garden City Garden City Co-op, Inc.",Garden City,"Garden City Co-op, Inc.","Garden City: Garden City Co-op, Inc.",https://www.gccoop.com/
Girard Producers Cooperative Association,Girard,Producers Cooperative Association,Girard: Producers Cooperative Association,https://www.girardcoop.com/
"Goodland Frontier Ag, Inc.",Goodland,"Frontier Ag, Inc.","Goodland: Frontier Ag, Inc.",https://www.frontieraginc.com
"Gorham United Ag Services, Inc.",Gorham,"United Ag Services, Inc.","Gorham: United Ag Services, Inc.",https://www.unitedag.coop
Great Bend American Plains Co-op,Great Bend,American Plains Co-op,Great Bend: American Plains Co-op,https://www.apcoop.com/
Halstead Farmers Coop. Elevator Co.,Halstead,Farmers Coop. Elevator Co.,Halstead: Farmers Coop. Elevator Co.,https://www.farcoop.com/
Hays Midland Marketing Co-op,Hays,Midland Marketing Co-op,Hays: Midland Marketing Co-op,https://www.midlandmarketing.org/
Hillsboro Cooperative Grain and Supply,Hillsboro,Cooperative Grain and Supply,Hillsboro: Cooperative Grain and Supply,https://www.cgsmc.com/
"Holton Jackson Farmers, Inc.",Holton,"Jackson Farmers, Inc.","Holton: Jackson Farmers, Inc.",https://www.jacksonfarmers.com/
Hope Agri Trails Cooperative,Hope,Agri Trails Cooperative,Hope: Agri Trails Cooperative,https://www.agritrails.com/
Isabel Farmers Cooperative Equity Co.,Isabel,Farmers Cooperative Equity Co.,Isabel: Farmers Cooperative Equity Co.,https://www.fceisabel.com
Luka Kanza Cooperative Association,Iuka,Kanza Cooperative Association,Iuka: Kanza Cooperative Association,https://www.kanzacoop.com/
Lansing Leavenworth County Co-op Assn.,Lansing,Leavenworth County Co-op Assn.,Lansing: Leavenworth County Co-op Assn.,https://leavenworthcoop.com/
Larned Pawnee County Co-op Assn.,Larned,Pawnee County Co-op Assn.,Larned: Pawnee County Co-op Assn.,http://www.pawneecoop.com/
"LeRoy LeRoy Cooperative Association, Inc..",LeRoy,"LeRoy Cooperative Association, Inc..","LeRoy: LeRoy Cooperative Association, Inc..",https://www.leroycoop.coop/
McCune McCune Farmers Union Cooperative Association,McCune,McCune Farmers Union Cooperative Association,McCune: McCune Farmers Union Cooperative Association,https://www.mccunecoop.com/
Moundridge MKC,Moundridge,MKC,Moundridge: MKC,https://www.mkcoop.com/
"Moundridge Producer Ag, LLC",Moundridge,"Producer Ag, LLC","Moundridge: Producer Ag, LLC",https://www.producerag.com/
Mulvane Mulvane Cooperative Union,Mulvane,Mulvane Cooperative Union,Mulvane: Mulvane Cooperative Union,https://www.mulvanecoop.com/
Oberlin Decatur Cooperative Association,Oberlin,Decatur Cooperative Association,Oberlin: Decatur Cooperative Association,https://www.decaturcoop.net
Offerle Offerle Cooperative Grain and Supply Company,Offerle,Offerle Cooperative Grain and Supply Company,Offerle: Offerle Cooperative Grain and Supply Company,https://www.offerle.coop/
Osborne Midway Co-op Association,Osborne,Midway Co-op Association,Osborne: Midway Co-op Association,https://www.midwaycoop.com/
Ottawa Ottawa Co-op Association,Ottawa,Ottawa Co-op Association,Ottawa: Ottawa Co-op Association,https://www.ottawacoop.com/
Piqua Piqua Farmers Co-op,Piqua,Piqua Farmers Co-op,Piqua: Piqua Farmers Co-op,http://www.piquacoop.com/
Randall Randall Farmers Co-op Union,Randall,Randall Farmers Co-op Union,Randall: Randall Farmers Co-op Union,https://www.randallcoop.com/
"Rozel Golden Valley, Inc.",Rozel,"Golden Valley, Inc.","Rozel: Golden Valley, Inc.",https://www.gvinc.coop
Sabetha Berwick Cooperative Oil Co.,Sabetha,Berwick Cooperative Oil Co.,Sabetha: Berwick Cooperative Oil Co.,https://www.berwickoil.com/
Scott City Scott Cooperative Association,Scott City,Scott Cooperative Association,Scott City: Scott Cooperative Association,https://www.scottcoop.com/
Seneca Ag Partners Cooperative,Seneca,Ag Partners Cooperative,Seneca: Ag Partners Cooperative,https://www.agpartnerscoop.com/
Sharon Springs 21st Century Bean Processors,Sharon Springs,21st Century Bean Processors,Sharon Springs: 21st Century Bean Processors,https://21stcenturybean.com/
Sharon Springs CHS United Plains Ag/CHS Quinter,Sharon Springs,CHS United Plains Ag/CHS Quinter,Sharon Springs: CHS United Plains Ag/CHS Quinter,https://chsunitedplainsag.com/
"Smith Center Trinity Ag, LLC",Smith Center,"Trinity Ag, LLC","Smith Center: Trinity Ag, LLC",https://www.trinityagllc.com/
"Spearville Alliance Ag & Grain, LLC (Right Co-op in Wright, Farmers Co-op in Haviland, Southern Plains Cooperative in Lewis, Cooperative Elevator and Supply Company in Meade)",Spearville,"Alliance Ag & Grain, LLC (Right Co-op in Wright, Farmers Co-op in Haviland, Southern Plains Cooperative in Lewis, Cooperative Elevator and Supply Company in Meade)","Spearville: Alliance Ag & Grain, LLC (Right Co-op in Wright, Farmers Co-op in Haviland, Southern Plains Cooperative in Lewis, Cooperative Elevator and Supply Company in Meade)",https://www.aaggllc.com/
St. Francis St. Francis Mercantile Equity Exchange,St. Francis,St. Francis Mercantile Equity Exchange,St. Francis: St. Francis Mercantile Equity Exchange,https://www.stfrancisequity.com/
Sterling Central Prairie Co-op,Sterling,Central Prairie Co-op,Sterling: Central Prairie Co-op,https://www.cpcoop.us/
Stockton Farmers Union Mercantile & Shipping Assn.,Stockton,Farmers Union Mercantile & Shipping Assn.,Stockton: Farmers Union Mercantile & Shipping Assn.,https://www.stocktoncoop.com/
"Sublette Sublette Cooperative, Inc.",Sublette,"Sublette Cooperative, Inc.","Sublette: Sublette Cooperative, Inc.",https://www.sublettecoop.com
Ulysses Skyland Co-op/Skyland Grain,Ulysses,Skyland Co-op/Skyland Grain,Ulysses: Skyland Co-op/Skyland Grain,https://www.skylandgrain.com/
Wheeler Wheeler Co-op Mercantile Equity Union,Wheeler,Wheeler Co-op Mercantile Equity Union,Wheeler: Wheeler Co-op Mercantile Equity Union,http://www.wheelerequity.com/
Yates Center SEK Co-op,Yates Center,SEK Co-op,Yates Center: SEK Co-op,https://www.sekcoop.com/
